Emotion,Text
joy,"@theclobra lol I thought maybe, couldn't decide if there was levity or not"
joy,Nawaz Sharif is getting more funnier than @kapilsharmak9 day by day. #laughter #challenge #kashmir #baloch
joy,Nawaz Sharif is getting more funnier than @kapilsharmak9 day by day.  #challenge #kashmir #baloch
joy,@tomderivan73 😁...I'll just people watch and enjoy a rare show of optimism
joy,I love my family so much #lucky #grateful #smartassfamily  #love
joy,I love my family so much #lucky #grateful #smartassfamily #hilarious #love
joy,"@Casper10666 I assure you there is no laughter, but increasing anger at the costs, and arrogance of Westminster."
joy,"If any trump supporters and Hillary haters wanna chirp some weak minded, pandering liberals just tweet at @EmmyA2 @snickerfritz04"
joy,Google caffeine-an sprightly lengthening into the corridor re seo: WgJ
joy,"This tweet is dedicated to my back pain, which I do not understand because I am youthful and spry. Full of life. Vivacious."
joy,@Bluebelle89 @lsmith855 liking the optimism
joy,"Be it a rainy day, be it cheerful sunshine, I am a Prussian, want nothing to be but a Prussian.:|"
joy,@Gronnhair @buryprofs @DittoBistro it was indeed lovely and the team were incredibly attentive and on the ball. Cheese was a lively gesture!
joy,"@Geminiak @LondonNPC you're welcome! #wordgeek \nAlso, good to put a face to the twitter feed, even if it was only a cheery hello! 😀"
joy,"...at your age, the heyday in the blood is tame...' @TheArtofCharm #shakespeareaninsults #hamlet #elizabethan #williamshakespeare"
joy,i was so embarrassed when she saw us i was like knvfkkjg she thinks we're stalkers n then she starts waving all cheerfully inviting us in 😩
joy,"Good #CX most often doesn't require all that much. #smile, #care, #relate and be #helpful. Thanks, Lakis Court Hotel in #cyprus"
joy,4-2 Canada final tomorrow #WCH #Predictions #optimism #Canadian 🇨🇦
joy,I turn 25 in two weeks. I am so happy. 24 was my darkest year yet. I am elated that I survived
joy,"TheNiceBot: IndyMN I thought the holidays could not get any more cheerful, and then I met you. #TheNiceBot #الخفجي"
joy,The smell of freshly cut grass didn't even cheer me up...boy oh boy
joy,@NateBLoL no it was that clear American naturally flavored sparkling water
joy,"A cheerful heart is good medicine, but a broken spirit saps a person's strength.' {Proverbs 17:22} #WednesdayWisdom"
joy,Somebody who has braved the storm is brewing. #cheerful
joy,Somebody who has braved the storm is brewing. 
joy,"Ready for that nice, breezy, calm, sunshine weather.🍂🍁 #Autumn"
joy,"it gets better. without explanation; you just wake up one morning and you’re just happy, totally and utterly elated."
joy,"Imagine how sad LA fans are gona be when they get eliminated...Man that's gonna be Nirvana, a religious experience rejoicing in their misery"
joy,Heather that was #hilarious! @MsHeatherBates @pattonoswalt @chrishansen #AnthonyWeiner #15gets20 #NYC
joy,Val reminds me of one of the cheerful witches that looks after Aurora in Disney’s Sleeping Beauty. #GBBO
joy,@GameGrumps THANK YOU SO MUCH FOR COMING TO DETROIT I'm going to sob joyful rainbows now brb
joy,So far ours greet have raised £250 for @HGatChristmas with more to come in #sparkling @CllrJohnFox @simoncotton69
joy,Each day is what you make of it! #goals #challenges #business #goals   #success #photographer #photography #ThursdayThoughts
joy,Each day is what you make of it! #goals #challenges #business #goals #optimism #happy #success #photographer #photography #ThursdayThoughts
joy,"If you don't respond to an email within 7 fays, you wifl be killed by an animated gif of the girl from The Ring."
joy,"It's #HobbitDay! \nHobbit's give gifts on their birthdays, so I'm sharing the gift of #glee today! Find something that makes you happy!"
joy,incredible that anthony weiner has been caught chasing a busty milkmaid across a park at double speed while jaunty music plays
joy,"@len_snart Mick nods. 'I would like that.' He went back to his food, smiling as he finished it."
joy,@yungdoujin wouldn't that basically be sparkling water
joy,"I'm absolutely in love with Laurie Hernandez, she's so adorable and is always so cheerful!"
joy,@HunterDean_ [he gives a gleeful squeak and wraps around you] All mine!
joy,"@diehimbeertonis She developed her 'forced smile'. I can force myself to describe it 'a little hearty maybe, sanki biraz':)"
joy,"When we give cheerfully and accept gratefully, everyone is blessed. »Maya Angelou"
joy,A #new day to #live and #smile. Hope all the #followers a nice #night or #day. :D
joy,"@DocBellsSwan *peers down at you, eyes crinkling with mirth and affection* I do love ye so, my bonnie Belle."
joy,@bruins_514 @gorddownie @thehipdotcom It would be #TragicallyHip if they can #help @TOYSFORASMILE make #hospitalized  #sick #kids #smile 😊✌❤
joy,Chris would take full responsibility and would want us all to rejoice in the memories we all had with him.
joy,@Communism_Kills i get the subway melt and make sure it's only hearty italian bread... black olives are a must though
joy,@hesham786 that's the spirit #optimism
joy,@hesham786 that's the spirit 
joy,"If yiu don't respond .o an email within 7 days, you willxbe killed by an animated gif of the girl froa The Ri.g."
joy,@harrietemmett great minds think alike. #rejoice
joy,@harrietemmett great minds think alike. 
joy,Dolores.' A thin lipped smile graced glossed lips as she let blues peer over at the woman. ' A constant delight.. As always.'
joy,"@airtelindia have some issues with my broadband bill ,I am charged for the month before I signed up with airtel.. #hilarious"
joy,"@airtelindia have some issues with my broadband bill ,I am charged for the month before I signed up with airtel.. "
joy,@Bridget_Jones was joyous. Worried I would be disappointed. Most definitely was not. #chickflick #giggles #comethefuckonbridget
joy,Metal keeps you young and spry and keeps your hair luxurious.\n\nYES\n\nSHUT UP AND LISTEN TO ME
joy,I hate it when im singing and some idiot thinks they can just join in with me like...this is not fcking glee #MeanRikonaBot
joy,@chencouture LMAO Is it that 'so slutty' hater girl? That video was hilarious. 😂
joy,@MichiganBromo Good optimism sir :)
joy,@billie21806 @cnnbrk tell that to your bodies cheering on the deaths of black people by cops. their fear is killing us.
joy,@MacDsmash you should get some @SSB_Swedish delight
joy,@kwelbyroberts they will come and you will rejoice at their arrival.
joy,[Moment of levity on the B41] Baby: I want ISIS! Give me ISIS!\nMom: Shh!\nBaby: I want ISIS!\nWest Indian woman: She wants what?\nMom: *Ices*.
joy,@tomlinmayniac starting my new challenge ! A glee poll every day !
joy,How can l rule my mind !!!!!! \nIt's hilarious that you can't 😭😑😮
joy,A lifetime of laughter at the expense of the death of a bachelor
joy,"Our tone of voice: we're like One Direction, we're thoughtful and timid, yet playful"
joy,Sioux Valley wins home competitive #cheer invite with a score of 158. ...Dell Rapids second at 138
joy,Tutoring gives me such an exhilarating feeling. I love helping people 😌
joy,"@PhilGlutting Hey There Phil Glutting thank you for following us, it's appreciated :) #smile"
joy,"@PhilGlutting Hey There Phil Glutting thank you for following us, it's appreciated :) "
joy,It feels good to get outside for a minute and get some fresh air.  It's hard to stay cooped up inside all day #breezy
joy,It feels good to get outside for a minute and get some fresh air.  It's hard to stay cooped up inside all day 
joy,@r0Ils ppl get triggered over u smiling they're irrelevant
joy,@GigaFag @pipertownsend_ snapchat new would beg to differ #optimism
joy,@GigaFag @pipertownsend_ snapchat new would beg to differ 
joy,A hearty Jonza! to all my friends and follower.
joy,"You must be knowing #blithe means (adj.)  Happy, cheerful."
joy,Old saying 'A #smile shared is one gained for another day' @YEGlifer @Scott_McKeen
joy,Bridget Jones' Baby was bloody hilarious 😅 #BridgetJonesBaby
joy,@Elaminova sparkling water makes your life sparkly
joy,I'm tired of everybody telling me to chill out and everythings ok. no the fuck its not. I'm tired of faking a a fucking smile
joy,#GBBO can cheer me up ☺️
joy,"&amp; as much as I hate for a dude to cheat, women forego pleasing their man, they get lazy &amp; men get lazy &amp; then it's just pointless"
joy,@GOT7Official @jrjyp happy birthday jin young!!!!!! #PrinceJinyoungDay #happyjinyoungday #got7  #birthday
joy,@GOT7Official @jrjyp happy birthday jin young!!!!!! #PrinceJinyoungDay  #happyjinyoungday #got7 #happy #birthday
joy,The race advances only by the extra achievements of the individual. You are the individual. ~Charles Towne\n #optimism #inspire
joy,The race advances only by the extra achievements of the individual. You are the individual. ~Charles Towne\n  #inspire
joy,"Watching football matches without commentary is something that I rejoice, found a transmission of City’s match like that today, joyful."
joy,#twd comes on soon #happy
joy,#twd comes on soon 
joy,@TauDeltaPhiDK THANK YOU FOR MY OBAMA CUT OUT!!!!!! I am elated that he's back home😍
joy,"@DDogsScout 'Oh!' Almost with odd cheerfulness, Big Boss offers: 'Muzzle flash blinding. Accidental by the guy who became my best friend.'"
joy,Gemma Simmons is the bright spot of the premiere so far. #AgentsofSHIELD
joy,This is a beautiful day that the Lord has made. I will rejoice and be glad!!!
joy,Watch this amazing live.ly broadcast by @kelli.peterson #lively #musically.   Come WATCH
joy,"Sometimes I like to talk about my sadness.  Other times, I just want to be distracted by friends, laughter, shopping, eating...  \n\n#MHChat"
joy,Oi @THEWIGGYMESS you've absolutely fucking killed me.. 30 mins later im still crying with laughter.. Grindah.. Grindah... 🤓  hahahahahahaha
joy,So happy I live in NYC! See you tomorrow .....@SamHeughan @Barbour
joy,"Accept the challenges, so that you may feel the exhilaration of victory."
joy,For what a beautiful day. #elated
joy,For what a beautiful day. 
joy,@Langston_Hunter Yeah bro it eas hella exhilarating
joy,sometimes im sad then remember Margaret Thatcher is dead and then i rejoice
joy,This is not me brown nosing but I've listened to lots of housing ministers but @GavinBarwellMP #nhf16 impressed me more than any 
joy,This is not me brown nosing but I've listened to lots of housing ministers but @GavinBarwellMP #nhf16 impressed me more than any #optimism
joy,@APkrawczynski   Any possibly KG is being bought out as a player so that he can buy in from Glen as a minority owner?  #optimism
joy,Martin Roth leaving V&amp;A shoes the effects of #Brexit: bright and talented foreigners made to feel unwelcome and leaving U.K. #c4news
joy,one thing I can say is that you kept me smiling
joy,#blackish always has me #rollin #hilarious
joy,#blackish always has me #rollin 
joy,How is your toddler coping with the new arrival? Has he tried killing her yet?' they cheerfully ask.
joy,American Schools are lively
joy,Drawing mini-comics is joyful; folding mini-comics is meditative and relaxing. I think I need to do them for more than just Halloween...
joy,"@Malkarii_ Korgoth of Barbaria for brutality, King Julian for hilarity, and Ariel... Because hot..."
joy,"i love those #memories that randomly pop\ninto my head , have me #smiling like an\n#idiot for ages 󾌴"
joy,"@TurtleTitan2003 (She laughed a bit. Of course it was! Aria shook her head, calming her mirth so she could listen to Mikey.) No, actually. +"
joy,@IreneEstry can't wait to see you Hun #cuddles #gossip #laughter
joy,@IreneEstry can't wait to see you Hun #cuddles #gossip 
joy,God hears your voice optimism at the moment that you think that everything has failed you ✨.
joy,My bf drove out of his way after a long day just to spend 15 min holding me to make me feel better. How'd I get so lucky #lucky #happy
joy,My bf drove out of his way after a long day just to spend 15 min holding me to make me feel better. How'd I get so lucky #lucky 
joy,Love this! Laughing while crying works too! #katherinemansfield #failure #laughter #dealingwithfailure
joy,Love this! Laughing while crying works too! #katherinemansfield #failure  #dealingwithfailure
joy,"They tend to loosen up a bit when drunk, and can seem pretty cheerful."
joy,🍦🎿 god chirp this burp 🎿🍦
joy,"We so elated, we celebrated like Obama waited until his last day in office to tell the nation, brothers is getting their reparations"
joy,angel delight is my everything
joy,I just want to let everyone out there know you are wonderful people! #beyourself #happy #cheerful #late-night #compliment #behappy
joy,I just want to let everyone out there know you are wonderful people! #beyourself   #late-night #compliment #behappy
joy,#terribledebatequestions has given me so many laughs this afternoon! Thanks Twitter! #hilarious #cleverpeople
joy,#terribledebatequestions has given me so many laughs this afternoon! Thanks Twitter!  #cleverpeople
joy,"@paraplyene @soupper i just read it and it's so fun??!!!! So lighthearted and cheerful, i was right, it's a double cavity for me."
joy,I'm at the point in my life that I'm playing Christmas music in my room because i need winter and joyful times rn
joy,"Luis Ortiz ducked by Ustinov which means fights off, and he left @GoldenBoyBoxing future not looking to bright for Ortiz #boxing"
joy,Another joyful encounter in Tribez &amp; Castlez! I just met Bartolomeo! Do you want to know who that is? Download the game and find out!
joy,"@CarolynTopol Ciara asks was it a sci-fi movie, Julie &amp; Jen just stare, Claire on her phone, Joey bolts when the cab honks. LMAO #hilarious"
joy,"@CarolynTopol Ciara asks was it a sci-fi movie, Julie &amp; Jen just stare, Claire on her phone, Joey bolts when the cab honks. LMAO "
joy,Happy Birthday @Brooke56_56 #cheer #cheerchick #jeep #jeepgirl #IDriveAJeep #jeepjeep #Cheer
joy,The little sniffle at the end of the song gets me every time. #rejoice
joy,The little sniffle at the end of the song gets me every time. 
joy,"I mean, is she supposed to seem joyous when she's talking Rodrigo Duterte, ISIS, the American economy, etc.? Think about what you're saying."
joy,@XenoStateOfMind yes\n\nmake her smile and be happy\nshe deserves happiness
joy,Keep smiling :)
joy,Ever wake up and instantly feel happy?
joy,@jpodhoretz I still respect you. I suppose there is so little to be gleeful about these days so take what you can. Good for you.
joy,@amstrado_CPC @ShittySUFanart the single tear is him being joyous that he's deleted the monster that has brought generations of despair
joy,"#Quoteoftheday\r\r'If you don't do #wild things while you're young, you'll have nothing to #smile about when you're old.'\r\r#dailyquote #quotes"
joy,All the bright places :(
joy,I'm honored to take on such a role in their joyous day. Hopefully I don't fuck it up
joy,I'm the reason I smile everyday 💯
joy,"@NoorBazzi14 lowkey I want to go just to chirp Anna LOL but say hi to Atkins for me!! One of my favourite coaches, he's smart and caring"
joy,It's all about #redwine and #glee
joy,It's all about #redwine and 
joy,"@tabstamlyn @lara_hunt1 I will, next time I'll make sure everything is sparkling clean"
joy,Take my kindness for weakness when you acting silly keeping it 100 ain't your forté  #ChrisBrown #TeamBreezy
joy,Take my kindness for weakness when you acting silly keeping it 100 ain't your forté #breezy #ChrisBrown #TeamBreezy
joy,"I envy the relentless, your cheerful smile aimed at the pouring rain, your positive attitude is an art you have continually mastered."
joy,"I'm moving this weekend &amp; my sugar daddy will replace it so, it is what it is. Niggas still happy."
joy,Anyone who drinks sparkling water is a demon
joy,Modern family never fails to cheer me up. Especially Phil.
joy,#smile #instagramers : #Selfie#BestMeSelfie#Me#Smile#BestMeCameraIsGreat#EmojiGrid#LikeforLike#Friend#Girl#Boy#Tattoos#Family#6Pack#G...
joy,@Author_LB Awesome. My 9 yr old grandson runs cross country. No Simon Whitfield but still a lot of fun cheering him on.
joy,18' \nMichael Carrick as struck the back of the net much to the delight of under pressure man u fanz and MOU...
joy,"@ruthwalford95 you may be right, but since year the bad events begin with B, I'm privately hoping we've got at least C-Z to go 1st #optimism"
joy,"@ruthwalford95 you may be right, but since year the bad events begin with B, I'm privately hoping we've got at least C-Z to go 1st "
joy,@ditzkoff @jpodhoretz There’s not a metaphor in the world that will get at the hilarity of jpod pronouncing on humor.
joy,Successful people always have two things on their lips #silence nd #smile smile to avoid problems nd silence to avoid the problems too
joy,in geometry today hannah started crying of laughter because ms. canning said 'pp' lol
joy,@WHUFC_HUB @westhamtransfer @TheHammers_ I don't see any reason for optimism at this point. Just stringing together bad performances.
joy,y'all shabazz's name in my phone is 'easy breezy beautiful' &amp; I will not apologize.
joy,"During the day @JeffProbst is jovial. At #TribalCouncil he's a different,  darker fellow.  Still simply but smiles are few. #Survivor"
joy,🎉 It is time for a most joyous celebration! 🎉
joy,@FilthyFrank My first time watching your vids and i died of laughter. Keep this up dude
joy,@DumTeeDum don't think Ian knew of Pavel. He knew about Charlie. I bet Rob will cackle with glee when he heard what has happened #thearchers
joy,Mou is too jovial and trying to impress those players too much. No player is bigger than manutd. SAF won't tolerate all this bs @ManUtd
joy,Your #smile is a messenger of your good will.
joy,imagine if teppu got animated by madhouse tho &gt;_&lt;
joy,I'm highly animated even though I'm decomposing.
joy,jk. started this week strong and it's still going strong. #optimism
joy,jk. started this week strong and it's still going strong. 
joy, @cailamarsai you've had me   the whole time watching @black_ishABC after you've lost your #glasses! It was #hilarious! @mrbabyboogaloo
joy,Town is lively. Something happen?
joy,"So today, I un armed my silence. My lungs rejoice in freedom. My insides had color too! A woman counted! My jawbone became a razor! For free"
joy,@SQLBek My liver is elated that isn't us
joy,"Symmetry is Key, everything must be aesthetically pleasing as possible, that is why I hold you twin pistols. #DeathTheKid #Bot"
joy,"Oii oiii, @Louis_Tomlinson !!  \nTHANK YOU for always making me smile ! MY BIRTHDAY is in 16 days. 🎉 Mind following me as a gift ? 🎁 X225,884"
joy,@Steeeevie_ breezy luvvvv
joy,My @timehop literally cracks me up when I see posts from 2 years ago and later 😂 
joy,My @timehop literally cracks me up when I see posts from 2 years ago and later 😂 #hilarious
joy,@ByeKandace can't cheer for a jigaboo
joy,@daveweigel a laurel and hearty handshake
joy,"@Bhavnay that, i dont mind too much. smoother, thicker texture. makes it more hearty. also, im glad iced coffee is a thing in the uk now."
joy,@LeeJarvis10 can't be following u pal he's smiling
joy,love to play underlord while listening to cheery anime music
joy,It's an exhilarating feeling. Working hard and feeling accomplished whether they notice or not--- you feel fu*king good 🤑
joy,"Starting at 22 minutes, this week's @bestshow4life is straight-up paradigm shift level mirth."
joy,someone teach me how to cheer someone up
joy,"@GreatDismal @Bencjacobs and it’s gleeful because they’re so inspired, so convinced they’re winning and at last have their strongman"
joy,Avoiding hearty basset hound no time present-time american the brave: YDXef
joy,alternate reality where @PoetryFound has a comments section and you can give poems a cheery thumbs up or a disappointed thumbs down
joy,@ThatBritishDude no okay you don't not need to be going out of your way to make sure you are pleasing everyone do what makes you happy
joy,"and I think some of our most spiritually weighty experiences came, counterintuitively and recognized in hindsight, in levity and daily grace"
joy,"@TheGoatShow @GameGrumps now that I have been sucked into this wormhole of hilarity with no escape, I can say how weird and accurate this is"
joy,@p_dortch7 I make sacrifices to make you happy
joy,I'm ever so cheerful
joy,@MarkDice Agreed.So tired of this nonsense . Soros must be elated.
joy,@Get_Quenched16 Attempts by Western degenerates 2 imply that DPRK stoops to levity will be met by devastating nuclear retaliation.
joy,"Girlfriends cooking me dinner again. spag blow it is, not to sure if she need my help 😂😂 #girlfriends #happy"
joy,"Girlfriends cooking me dinner again. spag blow it is, not to sure if she need my help 😂😂 #girlfriends "
joy,Hannah: 'This week on Survivor: Find out who is more buoyant. Gen X or Millenials!' #survivor
joy,Could not be happier!! #happy
joy,Could not be happier!! 
joy,@joemrusso happy birthdayyyyyy pretty. Miss you!
joy,"🍃When #life shows you have a hundred reasons to cry, show it that you have a hundred and one reasons to #smile. 🍃 #quotes @Mind_Console"
joy,"A #smile can mean a thousand words, but it can also hide a thousand #problems. #Fact #TeamFollowBack"
joy,Gen 8:21 NIV—The Lord smelled the pleasing aroma and said in his heart: “Never again will I… lifelong depravity
joy,Such merriment &amp; laughter from @dadwroteaporno at @KingsPlace &amp; an instructional PowerPoint presentation.Well done to all concerned &amp; thanks
joy,But uncle buck is on tho . #UncleBuck #hilarious
joy,But uncle buck is on tho . #UncleBuck 
joy,"Every time people push #Prescription Pot, prohibitionists rub their hands with #glee because U hand them #Cannabis &amp; yourself into #slavery."
joy,"@ChrisLoesch @DLoesch Modern Day book-burning without all that awful guilt. Oh, and now with more gleeful social sharing for the a$$hats."
joy,✨you make me happy @EthanDolan @GraysonDolan✨
joy,"#IfIWerePresident \nMy goal would be for us all to be miserable, yet jovial in the Co. of others. U know, civil but with realization of self."
joy,"Learning is key while converting your leaning to someone else is door, so when you do both you will open the door of success.\n\n#x33 #smile"
joy,"Learning is key while converting your leaning to someone else is door, so when you do both you will open the door of success.\n\n #x33 "
joy,"Iniesta still the one player I idolize from Barca,a delight to watch I tell you"
joy,"Every time I hear @jtkantor's organ kick in on the new @sayswhopodcast, I break into the goofiest smile."
joy,"Well, this is cheery. #MrRobot"
joy,@Gennneral thanks gen!! Love you miss you happy birthday natong duha 💘💘
joy,#survivor is back! #SurvivorMillennialsVsGenX so happy to see you @JeffProbst 
joy,#survivor is back! #SurvivorMillennialsVsGenX so happy to see you @JeffProbst #happy
joy,@essdotX the jovial and forgiving negro is always pressed upon to act against his/her self-interest in favor of the oppressor
joy,@ReginalTSquirge you could add a jaunty bow\nOr bells
joy,tweet tweet chirp chirp losers
joy,Be content .... Life is too short. #smiling
joy,Be content .... Life is too short. 
joy,"@npagliaro1 That's awesome!  p.s. ok, what are the odds of that, swapping neighborhoods? #hilarious"
joy,"@npagliaro1 That's awesome!  p.s. ok, what are the odds of that, swapping neighborhoods? "
joy,I'm so excited to see Nat tonight 😍😍.. And how happy and cheery she is! &amp; then I'm even more excited for her to get on social media 😍 #BB18
joy,“Set up as an ideal the facing of reality as honestly and as cheerfully as possible.” - Karl Menninger     #2ndHalfWealth
joy,what's the nicest way to tell someone cheerfully whistling outside my apartment door that I will end them should they continue to whistle
joy,@xiankiefer @TheLincoln Book 5! It's so sprightly &amp; fun cuz he'd been reinvigorated by the Harry Potter series. I'm not kidding.
joy,How's it possible to go from cheery earlier to the worst mood possible now🙄
joy,3 Styles to Love now at Zales!  Three sparkling styles to love! Stop by and shop in store today.
joy,Kinda wished I watched mischievous kiss before playful kiss
joy,"Accept challenges in life, so that you may feel the exhilaration of victory."
joy,@MariamVeiszadeh why sick. I am rejoicing that it is only half
joy,"@Tjsotomayor snow pig,  that's hilarious. Lmaooo"
joy,"“Set a goal to achieve something that is so big, so exhilarating that it excites you and scares you at the same time.” \n― Bob Proctor"
joy,This Red Sox team is the equivalent of Tiger Woods in his heyday: no mercy.
joy,wanna always be the reason behind her happiness and i'll always keep her smiling no matter what happens♒💜.
joy,Did u laugh today? Laugh hard? I hope so..we NEED laughter now.  #love
joy,Did u laugh today? Laugh hard? I hope so..we NEED laughter now. #smile #love
joy,"@peregrinator1 I admittedly went into this series thinking we'd see the Jedi in their heyday, not as dysfunctional UN Peacekeepers in space"
joy,me taking a picture by myself: *awkward smile*\nme on picture day: *awkward smile*\nconclusion: stop smiling ;'(\n#pictureday2016 #smile #ornot
joy,Wishing the Ipswich Tigers good luck in their games throughout homecoming week!! We are cheering you on here at the City Office! GO TIGERS!
joy,My ukulele bag has fallen apart.  WELLL AT LEAST my life hasn't yet!! #Joys\n\n#quote  #problemsolving #behappy
joy,It is so exhilarating taking on the challenge of demonstrating + explaining WHY #JamesJoyce's #Ulysses is so endearing &amp; wonderful!
joy,"Yesterday , on 21 Sept. 2016 , i installed a new stratagem including audacity by rejoicing at Harbour tower,i will tenaciously follow up up."
joy,@partydelightsUK it's 5679787. Cannot DM you as we don't follow each other. Not such a #delight #party #fail #letdown
