Emotion,Text
joy, That sucks . You wanna go grab a beer ? 
joy,When we took out an 84 year old woman for the evening and had hamburgers. She described the evening out as her happiest night out in 20 years.
joy, Of course ! Both children and adults enjoy her books . 
joy, It is the symbol of laughing at hoar frost and fighting with snow . I admire the bravery of plum blossoms . 
joy,"After one year of searching, my friend and I have found a flat we are able to pay for."
joy, We're waiting in line to get one of Master Li's Chinese couplets . I got one last year and I had good luck all year ! 
joy,The day I was told that I had been accepted as a student of economics.
joy,My parents and brother came up over the weekend. We are a very close family. This was my first year away from home. They brought one jacko-lantern with a new design. That is the old joke that we have a great new design - it's always the same.
joy,"While having a discussion with a colleague of mine, I realized that her conception of man and work were similar to mine."
joy, Hi ! I'm Nancy . Nice to meet you . 
joy,Managed to run 30 Km on skis fairly simply.
joy,"He chuckled , delighted at having amazed her . "
joy,A meeting and a conversation with a woman (somewhat elder than me) who considers me as her child (she also has one child of her own). Last two years I lived with her (no relationship).
joy,"Last course, when I passed with good marks three subjects which I had previously failed."
joy," Sure , my sister-in-law and her husband just bought a house that way . They ’ re pretty satisfied with it . "
joy, I'm sure and I remembered your phone number . I'll call you . 
joy," Hi , Andy . I'm Judy . It's nice meeting you . "
joy,"When I recently managed to get my first consulting assignment \myself\"" i.e on my own initiative."""
joy,"I 'm just so excited , because he says I can be in charge of it . "
joy,When I met again a great friend and talked a little while with him. When I see again another I miss.
joy, never mind . Let's go to the falls and try again . 
joy,My girlfriend sent me a letter with a shiny picture in it.
joy,"I felt the greatest burst of joy when after being heavily ill for a long period, my father came back home."
joy,"I received an assignment back, and got an A+ grading."
joy,Today I did a lot better on my architecture project than I expected.
joy,"After my graduation exams I was waiting to get admitted to a post graduation course, however the situation was not very favourable for me and I was upset.  Suddenly, Bombay university offered me a seat and I landed up in Bombay for my post graduation studies.  This happened last year and was very pleasant for me."
joy,But I remember the excitement in my children 's faces . 
joy,"This time Ronni admitted it , feeling a little like a traitor at the confession -- and at the sense of pure delight she felt at Guido 's gesture . "
joy,Culley imagined Susan 's gleeful smile as she waited for Yorke to work it out . 
joy,"When I passed the B.A exams and my parents allowed me to carry on my studies and do a M.A. , I was very happy."
joy, That's right 
joy, Let's stop the car and enjoy it for a minute . 
joy,The first time I really fell in love with a girl.
joy,"Figurative arts , even more than poetry , expressed the mixed feelings of elation over past victories and fear of future incursions which the Celts inspired . "
joy,One of my friends and I had breakfast in a restaurant. It was spontaneous and lots of fun.
joy,"To our gratification , Blackwells , whom we had approached , expressed interest in the project , something we had not dared to expect . "
joy, That sounds like fun . But where can I get clothes that old ? 
joy,The contrast with her exhilaration on the frozen lake had come so swiftly . 
joy,"For my parents anniversary, we hosted a party and we were very happy."
joy, If that's okay with you . 
joy,When I got my B.Sc degree with first class.
joy,"Last night I had a chat with a fellow student.  I had known her for about half a year, and for the first time we were speaking \the same language\""- meaning an inspiring discussion and encounter."""
joy,I was very happy when I got an attractive Summer job.
joy,"They seemed happy about my victory in Germany and most of them expected me to win more races last year . "" "
joy,"I won the first prize at the science fair, the first of the kind at school and I was only in form II then.  "
joy,I was talking to a friend and he said something which was very funny.
joy,The inflammation of the ear of my child got cured and the doctor said that the ear was completely all right.
joy,That was heaven ! 
joy,What I didn't understand was why I didn't feel happy walking down the street afterwards . 
joy,I had a wonderful evening . 
joy,"I experienced joy at a friend's 22nd birthday party. We had good food, good liquid, good company, good music, and an overall warm atmosphere. The birthday girl and I communicate incredibly well. I felt very content, warm and inspired just talking with her giving her a neck massage."
joy,When my one year old son gives me a spontaneous kiss.
joy,Having a good trip on a boat with good friends.
joy,"When someone made me a compliment after an examination just at the moment I needed it. It was amicable, hearty and sincere."
joy,Emotional reassurances by spouse.
joy,I took a math midterm and I knew I did really well and it was Friday so I felt great joy because the week was over and I did well on a test.
joy, Good.Let ' s go now . 
joy,"Obviously , staff will be delighted that the appointment of a new Director has been made and sad that Tom has gone but it is the proposed reorganisation which will occupy the minds of most staff . "
joy, How about Bill's Seafood Restaurant ? 
joy,China winning the Asian Olympic.
joy,The man I am going around with gave me a very special present.
joy, I don't need a car . I walk to work . 
joy, That would really help me a lot . I'm very grateful . 
joy, It ’ s true . Michelle is a lot like Henry in so many ways . And she is shy with new people just like he is . 
joy,In summer when I was sailing with friends in Greece I felt joy.
joy,"Perhaps elated behaviour has evolved in connection with a rise in the hierarchy , depressive behaviour with a fall . "
joy,"She was greeted with a sympathetic , and rather amused smile . "
joy,My admittance to the University.
joy,How do you like the pizza here ? 
joy, I like him.He ' s good for her . 
joy,"Jim , how was your weekend ? "
joy,@drakellaj: I hope you know that y'all the reason I have fun still
joy,"To his absolute delight the first trap had held what must have been a seven pound salmon , plus a couple of mullet which he had ignored . "
joy,"When my special friend said \I love you\"" for the first time."""
joy,When passing the final examinations for social worker.
joy,First time I slept with my present girlfriend. Had been best friends for a year but had been hesitant about getting involved emotionally.
joy," Oh , I love the roof tiles on Spanish style houses . "
joy,"During the period of falling in love, each time that we met and especially when we had not met for a long time."
joy,Maggie felt an odd excitement stirring inside . 
joy,As an evening class teacher I got positive feedback.  When the atmosphere is good and a kind of relaxed understanding exists.
joy,"I felt a great joy when I knew that my father was going to sell the apartment from GUARUSA, because in some way we were helded by it, that means that we didn't go to any other place, because we had the apartment."
joy,When my boyfriend came form Rumphi to London for a visit I was very happy to see him and couldn't believe it was him with me.
joy," Life is like a box of chocolates , you never know what you're gonna get . "
joy,Saw on TV China winning the gold medals.
joy,"When I saw a friend of mine, whom I had not seen for a long time and I had lost his address and telephone number."
joy,"Paula , mother of Nicola , 4 , and Richard , 2 , was pleased when the local council made the playground in the town park more child-friendly . "
joy,"When I learned, after the ecography, that my mother was expecting a baby girl.  That was what I wanted."
joy, Bye . 
joy," Yes , I'd love to.Here is a good one , Mozart and Beethoven.It ' s on the Festival Hall.Shall we go there ? "
joy,"I have explained to pupils that I do not know ` the answer "" and so I can share the excitement of working out a problem with them . "
joy," Yes , I'll be waiting for you in my home by 10:00 . "
joy,One could get terribly ecstatic but that would be a dangerous thing to do . 
joy,"When finally I found a place to live, I felt relieved, predicting changes in my life, and I became happy."
joy,"Whereas in Crime and Punishment and in the novels which follow he can , though his narrow glee over being ahead of the fact is unworthy of his art and of what ` idealism "" and ` deeper realism "" intend . "
joy,We were all very worried about you and I 'm delighted you 're home again . 
joy, Sounds good . 
joy,"Look , daddy is on again . Don't you think he is handsome ? "
joy,When I was accepted as a student of Psychology here at Guttenburg.
joy,Neighbours recalled how Ms Bailey was overjoyed at the birth of her daughter . 
joy,A few weeks back I received a Christmas card from a friend in England.  She had not written to me in a very long time but it     showed that she still remembered me.
joy,"For once in his life , Leopold must have been truly happy : his hopes and prayers for his beloved son seemed at last to have come to fruition . "
joy,I had the unexpected possibility to see a friend I like very much.
joy,"I wanted to go out to walk but I didn't know either where or with whom, suddenly an invitation appeared."
joy,"Nevertheless , your father ( and mother , too for that matter ! ) may well be very pleased if your boyfriend takes the time to have a chat with them . "
joy, That's OK with me . 
joy,"I was feeling really low - had been a series of fights with my siblings, been under pressure at school and wasn't going to the party I wanted to go - instead I was going out with my family. A guy called and said, in effect, that I was \nice\"" and he liked me. Hence the emotional joy."""
joy,I met my present boyfriend on a boat trip to England.  We had said that we would call each other when we got back to Sweden (we were not going to the same town in England).  As soon as I walked in he called from England as he could not wait till he came home.
joy,When I got my B.A degree with first class.
joy,When I saw my name in the newspaper and I knew that I entered at the University.
joy,"For the watching world , she smiled and laughed , seeming perfectly delighted with her husband and newfound status . "
joy," Yes , I can see . The summer heat is over , and the winter cold is still far away . "
joy," Yes , it ’ s exciting . This month we are doing crossword puzzles . "
joy,"When my lover and I felt like we had gone full circle. And our relationship was new, fresh, vital etc. once again."
joy,I was accepted by the Chinese university.
joy,"However , I thought you might share my amusement at the thought of baked beans at a low tension ! "
joy, This is a really great place to watch a baseball game . 
joy,I was for the first time on a brigade this year. At that time my sister was to bear a child. I was mad with joy when I opened the telegram from my parents and learned I had a nephew.
joy,When the church choir came one Sunday after being away for some weeks.
joy,Said his co-boss Curbishley : ` I was a bit disappointed when Lennie Lawrence at Middlesbrough didn't come up with the price we 'd fixed but I 'm happy the lad is still here . 
joy,"Mrs Thatcher has mastered the sound-bite , to be repeated at intervals like a mantra : ` So very pleased with how it 's going . "" "
joy,"I'm not afraid of tomorrow, for I have seen yesterday and I love today Onwards and upwards!"
joy,The feeling of joy when again I had confessed my sin and experienced God's forgiving grace and cleansing power - total enlightenment and freedome - bliss.
joy,When my sister - after a history of one abortion and one stillbirth - gave birth to a perfectly healty boy.
joy,A close married friend has just had his first child.
joy,I phoned a friend of mine to ask her for news about the marks in an exam.  She told me that I had passed.
joy," Well , I wish you luck here . "
joy, I'm an engineer at IBM . 
joy,"I had a singing-lesson, but I was not very good. The last exercise was singing scales. I did that very well and my teacher seemed satisfied."
joy,Receiving my result slip (pass) on my birthday.
joy," Thank you , I just tried my best . I am very happy to know you like it . "
joy," All right , sir . May I have your driver's license ? "
joy,"Receiving notification that I had made a successful application to the Speech Therapy course at Uni, gave me a very good feelig of achievment and joy."
joy,When I heard my name being announced on the radio that I had been successful in an interview for admittance for a medical Assistant training course. I was really happy and I enjoyed myself by dancing to music from the Radio cassette.
joy, I'm from Shanghai . And you ? 
joy,When I was selected to study here at university.
joy,The excited smile on her face told Ingrid that the girl was enjoying herself . 
joy, Please do that . I can't wait to come back again . The performance must be really amazing . 
joy,"I remembered his amusement about such underwear on his first evening at Sleet , how he subsided into laughter , infectious to everyone but me . "
joy,Got a present from my friend for my birthday.
joy,"When a study tour got confirmed, I was happy all the time till    the tour began."
joy, My first grandchild . 
joy,Reunion with my wife after a legal separation.
joy,"When I opened my TE Score envelope, and saw I got into Physiotherapy."
joy,"In a day when at work, in school, and relationships came out as I wanted, and I was recognized in my work."
joy,The army hadn't been too pleased about that little episode either . 
joy,When I passed an exam.
joy," Yeah , it reminds you why they say baseball is America ’ s favorite pastime . "
joy," Oh , that's exciting . What does this guy look like ? Is he hot ? "
joy," Come on , don ’ t flatter me anymore . I took the job because I love being challenged . But I can ’ t get this turned around without the support from you people . "
joy, I hear the beaches in Thailand are beautiful . 
joy,I was seriously injured in a road accident. The very first steps I took with only one crutch to support me I felt so good. I enjoy being alive.
joy,Robyn was almost ill with excitement and outrage . 
joy,When I passed the driving test (on the second try).
joy,The day I got a telegram telling me that I had been selected for a B.A at university.  I felt happy because I had not expected to be selected.
joy,After the funeral of an acquaintance I felt very depressed. That feeling turned into joy when I heard that I had achieved a good grade for an examination.
joy,I 'm thrilled to see her ! 
joy, They obviously thought I was doing terribly badly at that time and were very pleased at how well they had rigged me out  until I put on the mac . 
joy,I felt happy when I learnt that I had qualified for the grade eight.
joy," Oh , thanks , professor Donald . This is really very nice of you . "
joy,"Then , as could happen with him , he felt a deep despondency replace his feeling of elation . "
joy,"From the other end of the table Ymor watched with mild amusement , occasionally feeding one of his ravens with scraps from his plate . "
joy,I 'm delighted to learn that his advice has been sought in the present enterprise . 
joy,When my application for studying the masters degree was accepted. 
joy,Selling my used car.
joy,"I was in a dancing-tavern and the atmosphere was one of waiting for the end of the world.  Suddenly people began dancing wildly, inspired by the band.  An unbelievable experience : wonderful that even Finns sometimes flare up and forget to think \what others are thinking of me\"".  It was delightful to dance to one's heart content."""
joy,Professor Winston said : ` I 'm thrilled to see them all here . 
joy, I'm so honored that you thought to ask me . 
joy,"This would normally push up her heart rate but with her pulse already racing due to the alcohol , dancing and general party excitement the increase is not as noticeable as normal . "
joy,"When after 10 months of national service I was \downgraded\"" and did not have to do the remaining 5 months."""
joy,When I got a record as a gift from a friend.
joy,"Cranston repeated , fighting hard to control the excitement in his voice . "
joy,"His delight and sense of wonder at the growth of his baby were erratic as other interests pressed , but real enough . "
joy,"Whether or not the Palace actually arranged for the drawing to be removed , there can be little doubt that they were delighted to be rid of it . "
joy,"I had a picnic with old classmates, we chatted and played games."
joy, Yes . 
joy, About 6:00 . 
joy,"When my fiancee travelled 2000 Km to visit me, and I hadn't seen her for 4 months."
joy,"I had been very weary all week - no letters, no phonecalls, no visitors and then my younger sister came with some cheese, a card and some pocket money for me; and she told me that she was working now."
joy, You are doing the waltz wonderfully well . 
joy,A friend of mine often had difficulties with her parents. Once she had a child she had a better relationship with them.
joy,"You could make a fortune , "" she said in genuine amusement . "
joy,"I sensed such a feeling when I understood I was admitted to the University. I was at home, the atmosphere was still, though I myself was full of suspense. I tried to do different things. When the telephone rang and...! Yes, of course there were other situations when I felt a similar feeling but I was unmindful of them."
joy,I felt very happy when I was accepted at university for my studies.  I had not expected this as I had been ill during the exams.
joy,When I got accepted to CAL.
joy,"` They are naturally excited about getting the championship back after 33 years , "" he said . "
joy,When I got myself the kind of girlfriend I had been hunting for a long time.
joy,When I told my girlfriend a joke openly and frankly.
joy,"` Well , he was pleased when you agreed to this . "
joy,Article published.
joy,As I set off I had a fleeting glimpse of the leer of pure delight on Simkin 's face . 
joy,When I passed an exam.
joy,"When I stood first in the B.A exams.  Earlier I had heard of these boys and girls who were toppers, but when I first heard of me having topped I could not believe it."
joy, Ok . Take care . Have a nice journey . 
joy, You're dancing so well . 
joy, great . I ’ m looking forward to it . 
joy,On my birthday when several good friends came to visit me.
joy,When I was making music together with my friend. It sounded very good and we were very satisfied.
joy,I received a letter from a friend whom I was missing
joy,When I heard that I had been selected for the university.
joy,The birth of my first child.
joy," No , thank you . "
joy,When my children were born.
joy,"At a success of mine, at a real achievement."
joy,"When I was 17, I had a mystic vision. I melted into a dazzling light, which omitted perfect love. The physical experience became unimportant, I heard or saw the words overcome egotism. The feeling of joy remained for month after that experience."""
joy,I passed my MCE Examination. at first I was worried but when I heard my name I had joy in my heart and I arranged for a trip to attend a wedding ceremony.
joy,I received money from my father at a time when I was completely broken.
joy,Yesterday when I received a B on a history midterm. I felt overjoyed after having received C's previously.
joy, I heard it ’ s a very good movie . 
joy,` His gratification was almost unbounded when on arriving at the Belts of the Murray he found not only numerous new Species but new forms of Birds . 
joy, excellent ! That sounds like a plan . 
joy," You must have been prepared for a long time . Some statistics in this presentation are not easy to find , right ? "
joy," Maybe so , but do you have any idea how much this one is worth ? "
joy,"As Christmas approached , the excitement of preparation began to get through to her . "
joy, Oh ! That's much hetter than I did . 
joy,I passed an exam which I thought I had failed.
joy,When planning to marry.
joy,"` I 'm delighted they left you the house , "" Julia told Margaret . "
joy,"After watching the 49ers lose game after game, year after year, I was finally rewarded with a Super Bowl victory which made me extremely happy."
joy," Linda , thank you for this wonderful Christmas dinner . I really enjoyed it . "
joy,Finding out that I can go to your English lectures.
joy,My girlfriend gave me some feed-back and I understood that it meant that our relationship was about to turn even closer.
joy, Me too . Please write to me as soon as you get Boston . 
joy,"Not so , according to elated opponents of nuclear power . "
joy,When I was offered a place in the university as a full time student.
joy, Of course I should have ! You certainly deserve them ! You put up with all of us . 
joy,"However , in 1878 , deaf education in Greenock faced a crisis because there was no-one able to continue to teach the children , and one parent was not happy about his child being taught in sign language . "
joy," Yeah , I was really struggling whether I should give you this nice little car . It was the last one they had and I really like it so much myself . "
joy," Thank you , I will . Hope to see you again next year . "
joy,"When I was in Form 4, at Secondary School, I was elected as a school Library Assistant and also the leader of Catholic Students, so I felt very joyous."
joy,"I felt glad to live again when I went to a meeting about the \Knowledge\"". There are 4 techniques of meditation that connect you with the essence of the human being."""
joy," Yes , next March . "
joy," Yes , I think you ’ re right . I ’ m thinking about having a child , but not just yet . "
joy, I think you can go to visit the museum . It's worth seeing . You can go to the square some other time . 
joy,"There were amused smiles , but they did not know at all why Alain had done that . "
joy, I'm standing in front of an exquisite work of art ! 
joy, You're lucky ! 
joy,After making an effort to enter at University I found a course and a school of higher education which were compatible with my experience and potentiality.
joy, Look behind us at the mountains ! They're reflecting pink ! 
joy, You're welcome . Did you have a good time on this vacation ? 
joy,Talking with a nice girl.
joy," Congratulations , I hope everything works out . "
joy,When  fell in love with my present girlfriend.
joy,"My friend had organized a birthday party for me secretly, I was very happy not so much for the presents but because they seemed to care for me."
joy,"When I began dansing, the teacher came and told me that I was very good and would soon get into the ballet academy. "
joy," Oh , hi ! I'm Barbara Johnson . Nice to meet you . "
joy,"I had stayed for months without seeing mother because our holidays were short and my home is far. Some times, mother came to see me at school, I was very joyful, and I didn't want her to go."
joy,He had seen beyond the excitement of being approached for his first book ; he already visualised it on the bookshelves ! 
joy,Getting the top price in the football pools.
joy, Good idea . Can I bring some music from that period too ? 
joy,When I saw that I had passed an exam.  It was the last chance and there was a lot at stake.
joy,"Day before yesterday my mother bought me a new pair of shoes, without my having asked for them.  She told me that when she saw the pair of shoes she felt like buying them for me.  I really liked the shoes and they made me feel that my mother cares for me."
joy, I can't believe they would play so good . 
joy,When my affairs with the girl I love settled positively.
joy,"` They take young grandpas , "" said Linda , amazed and overjoyed he 'd had the idea for himself and still not able to get over her daughter 's news . "
joy,I'm glad when I have good relations with my colleagues and most of all when we are at a party.
joy,"I was in a restaurant with my boyfriend when I saw my best female friend after not seeing her for two weeks.  We rejoyced, hugged and had a long talk."
joy,"And I 'm really excited about it and there 's lots of interest , I think this places are taken up already . "
joy,When I got my drivers licence.
joy,"After a busy day I went back to my hostel.  I closed the door and had a drink, then I read my favourite book on the bed.  Suddenly I felt peace and joy."
joy,A boy I had been admiring so much asked me to go out with him.
joy,When I was selected at TISS X.
joy,George drove past and felt a terrible anger replace his elation . 
joy," I'd be delighted to , John . Saturday did you say ? "
joy,"She was interrupted by another hoarse , gleeful chuckle . "
joy,"He was gleeful about the idea of a Faber ` Vaudeville "" production in 1929 where he starred as a baritone singing Bolovian Ballads and a song about a blue baboon . "
joy," Yes , you have many opportunities to grow in this company as long as you do well . "
joy,"She cackled , delighted with the queasy mixture on the plate , hot brown coffee lapping at the pale wedge of sugared pastry . "
joy,Advertisers said they were delighted to see many of their proposals reflected in the Government 's approach . 
joy,"But Matta was gazing at him , and his grin was wider , more gleeful . "
joy,"During the Christmas holidays, I met some of my old friends, after not having seen them for six months."
joy,Seb reached Burford in a state of high excitement only to find that Superintending Constable Aplin was in London . 
